{
  "version": "1.0",
  "plan_id": "H4D-DSI-REM-DEMO-0001",
  "assessment_id": "H4D-DSI-DEMO-0001",
  "scope_mode": "self",
  "created_at": "2026-08-23T19:10:00Z",
  "items": [
    {
      "finding_id": "DSI-F-0001",
      "category": "account-security",
      "original_score": 92,
      "control_id": "DSI-CTRL-AUTH-001",
      "control": "Enable strong multi-factor authentication and review active account sessions.",
      "verification_step": "Confirm MFA is enabled on the intended account and review the account security/session page for unexpected sessions.",
      "status": "in-progress",
      "target_date": "2026-09-01",
      "verified_at": null
    },
    {
      "finding_id": "DSI-F-0002",
      "category": "privacy-exposure",
      "original_score": 55,
      "control_id": "DSI-CTRL-PRV-001",
      "control": "Reduce unnecessary public profile exposure and review audience settings.",
      "verification_step": "Re-open the relevant privacy/audience settings and confirm only intentionally public information remains visible.",
      "status": "verified",
      "target_date": null,
      "verified_at": "2026-08-23T19:12:00Z"
    },
    {
      "finding_id": "DSI-F-0003",
      "category": "family-safety",
      "original_score": 55,
      "control_id": "DSI-CTRL-FAM-001",
      "control": "Agree on a consent-based trusted support and escalation plan.",
      "verification_step": "Confirm the agreed trusted contact and appropriate platform safety/reporting channels are understood by the participants.",
      "status": "open",
      "target_date": null,
      "verified_at": null
    }
  ]
}
